{
 "cell": {
  "size_mm": 5.0
 },
 "default_radius_mm": 0.5,
 "edges": [
  {
   "n1": "N0",
   "n2": "N0",
   "shift": [
    0,
    0,
    1
   ]
  },
  {
   "n1": "N0",
   "n2": "N0",
   "shift": [
    1,
    0,
    0
   ]
  },
  {
   "n1": "N0",
   "n2": "N1",
   "shift": [
    -1,
    -1,
    -1
   ]
  },
  {
   "n1": "N0",
   "n2": "N1",
   "shift": [
    -1,
    -1,
    0
   ]
  },
  {
   "n1": "N0",
   "n2": "N1",
   "shift": [
    -1,
    0,
    -1
   ]
  },
  {
   "n1": "N0",
   "n2": "N1",
   "shift": [
    -1,
    0,
    0
   ]
  },
  {
   "n1": "N0",
   "n2": "N1",
   "shift": [
    0,
    -1,
    -1
   ]
  },
  {
   "n1": "N0",
   "n2": "N1",
   "shift": [
    0,
    -1,
    0
   ]
  },
  {
   "n1": "N0",
   "n2": "N1",
   "shift": [
    0,
    0,
    -1
   ]
  },
  {
   "n1": "N0",
   "n2": "N1",
   "shift": [
    0,
    0,
    0
   ]
  }
 ],
 "free_params": {
  "radius_mm": {
   "description": "全局杆半径(DB 覆盖区间)",
   "max": 0.55,
   "min": 0.25,
   "value": 0.5
  },
  "slider": {
   "description": "structure_set 拓扑变形参数(部分拓扑在 slider=8 改变连通性)",
   "max": 8.0,
   "min": 0.0,
   "value": 4.0
  }
 },
 "lineage": {
  "generator": "atlas.schema.seeds.seed_graph",
  "notes": [
   "原始杆去重 6 条(同 (n1,n2,shift))"
  ],
  "parents": [],
  "source": "ARTC-Auto-Script structure_set.get_crystal_structure(topology=G7, slider=4)",
  "tier": "seed"
 },
 "name": "G7",
 "nodes": [
  {
   "aliases": [
    "A",
    "A_",
    "B",
    "B_",
    "C",
    "C_",
    "D",
    "D_"
   ],
   "frac": [
    0.0,
    0.0,
    0.0
   ],
   "id": "N0"
  },
  {
   "aliases": [
    "O"
   ],
   "frac": [
    0.5,
    0.75,
    0.5
   ],
   "id": "N1"
  }
 ],
 "schema": "atlas-cell-graph/1.0"
}
