{
 "cell": {
  "size_mm": 5.0
 },
 "default_radius_mm": 0.5,
 "edges": [
  {
   "n1": "N0",
   "n2": "N10",
   "shift": [
    -1,
    -1,
    0
   ]
  },
  {
   "n1": "N0",
   "n2": "N11",
   "shift": [
    -1,
    -1,
    -1
   ]
  },
  {
   "n1": "N0",
   "n2": "N2",
   "shift": [
    0,
    0,
    0
   ]
  },
  {
   "n1": "N0",
   "n2": "N3",
   "shift": [
    0,
    0,
    -1
   ]
  },
  {
   "n1": "N0",
   "n2": "N4",
   "shift": [
    0,
    -1,
    0
   ]
  },
  {
   "n1": "N0",
   "n2": "N5",
   "shift": [
    0,
    -1,
    -1
   ]
  },
  {
   "n1": "N0",
   "n2": "N8",
   "shift": [
    -1,
    0,
    0
   ]
  },
  {
   "n1": "N0",
   "n2": "N9",
   "shift": [
    -1,
    0,
    -1
   ]
  },
  {
   "n1": "N1",
   "n2": "N10",
   "shift": [
    -1,
    0,
    0
   ]
  },
  {
   "n1": "N1",
   "n2": "N11",
   "shift": [
    -1,
    0,
    0
   ]
  },
  {
   "n1": "N1",
   "n2": "N2",
   "shift": [
    0,
    0,
    0
   ]
  },
  {
   "n1": "N1",
   "n2": "N3",
   "shift": [
    0,
    0,
    0
   ]
  },
  {
   "n1": "N1",
   "n2": "N4",
   "shift": [
    0,
    0,
    0
   ]
  },
  {
   "n1": "N1",
   "n2": "N5",
   "shift": [
    0,
    0,
    0
   ]
  },
  {
   "n1": "N1",
   "n2": "N8",
   "shift": [
    -1,
    0,
    0
   ]
  },
  {
   "n1": "N1",
   "n2": "N9",
   "shift": [
    -1,
    0,
    0
   ]
  },
  {
   "n1": "N10",
   "n2": "N3",
   "shift": [
    0,
    0,
    0
   ]
  },
  {
   "n1": "N10",
   "n2": "N6",
   "shift": [
    0,
    1,
    0
   ]
  },
  {
   "n1": "N10",
   "n2": "N7",
   "shift": [
    0,
    0,
    0
   ]
  },
  {
   "n1": "N11",
   "n2": "N2",
   "shift": [
    0,
    0,
    0
   ]
  },
  {
   "n1": "N11",
   "n2": "N6",
   "shift": [
    0,
    1,
    0
   ]
  },
  {
   "n1": "N11",
   "n2": "N7",
   "shift": [
    0,
    0,
    1
   ]
  },
  {
   "n1": "N2",
   "n2": "N6",
   "shift": [
    0,
    0,
    0
   ]
  },
  {
   "n1": "N2",
   "n2": "N7",
   "shift": [
    0,
    0,
    0
   ]
  },
  {
   "n1": "N3",
   "n2": "N6",
   "shift": [
    0,
    0,
    0
   ]
  },
  {
   "n1": "N3",
   "n2": "N7",
   "shift": [
    0,
    0,
    1
   ]
  },
  {
   "n1": "N4",
   "n2": "N6",
   "shift": [
    0,
    1,
    0
   ]
  },
  {
   "n1": "N4",
   "n2": "N7",
   "shift": [
    0,
    0,
    0
   ]
  },
  {
   "n1": "N4",
   "n2": "N9",
   "shift": [
    0,
    0,
    0
   ]
  },
  {
   "n1": "N5",
   "n2": "N6",
   "shift": [
    0,
    1,
    0
   ]
  },
  {
   "n1": "N5",
   "n2": "N7",
   "shift": [
    0,
    0,
    1
   ]
  },
  {
   "n1": "N5",
   "n2": "N8",
   "shift": [
    0,
    0,
    0
   ]
  },
  {
   "n1": "N6",
   "n2": "N8",
   "shift": [
    0,
    0,
    0
   ]
  },
  {
   "n1": "N6",
   "n2": "N9",
   "shift": [
    0,
    0,
    0
   ]
  },
  {
   "n1": "N7",
   "n2": "N8",
   "shift": [
    0,
    0,
    0
   ]
  },
  {
   "n1": "N7",
   "n2": "N9",
   "shift": [
    0,
    0,
    -1
   ]
  }
 ],
 "free_params": {
  "radius_mm": {
   "description": "全局杆半径(DB 覆盖区间)",
   "max": 0.55,
   "min": 0.25,
   "value": 0.5
  },
  "slider": {
   "description": "structure_set 拓扑变形参数(部分拓扑在 slider=8 改变连通性)",
   "max": 8.0,
   "min": 0.0,
   "value": 4.0
  }
 },
 "lineage": {
  "generator": "atlas.schema.seeds.seed_graph",
  "notes": [],
  "parents": [],
  "source": "ARTC-Auto-Script structure_set.get_crystal_structure(topology=Rhombic, slider=4)",
  "tier": "seed"
 },
 "name": "Rhombic",
 "nodes": [
  {
   "aliases": [
    "V1",
    "V2",
    "V3",
    "V4",
    "V5",
    "V6",
    "V7",
    "V8"
   ],
   "frac": [
    0.0,
    0.0,
    0.0
   ],
   "id": "N0"
  },
  {
   "aliases": [
    "FC3",
    "FC4"
   ],
   "frac": [
    0.0,
    0.5,
    0.5
   ],
   "id": "N1"
  },
  {
   "aliases": [
    "D13_1"
   ],
   "frac": [
    0.2,
    0.2,
    0.2
   ],
   "id": "N2"
  },
  {
   "aliases": [
    "D13_2"
   ],
   "frac": [
    0.2,
    0.2,
    0.8
   ],
   "id": "N3"
  },
  {
   "aliases": [
    "D13_3"
   ],
   "frac": [
    0.2,
    0.8,
    0.2
   ],
   "id": "N4"
  },
  {
   "aliases": [
    "D23_4"
   ],
   "frac": [
    0.2,
    0.8,
    0.8
   ],
   "id": "N5"
  },
  {
   "aliases": [
    "FC5",
    "FC6"
   ],
   "frac": [
    0.5,
    0.0,
    0.5
   ],
   "id": "N6"
  },
  {
   "aliases": [
    "FC1",
    "FC2"
   ],
   "frac": [
    0.5,
    0.5,
    0.0
   ],
   "id": "N7"
  },
  {
   "aliases": [
    "D13_4"
   ],
   "frac": [
    0.8,
    0.2,
    0.2
   ],
   "id": "N8"
  },
  {
   "aliases": [
    "D23_3"
   ],
   "frac": [
    0.8,
    0.2,
    0.8
   ],
   "id": "N9"
  },
  {
   "aliases": [
    "D23_2"
   ],
   "frac": [
    0.8,
    0.8,
    0.2
   ],
   "id": "N10"
  },
  {
   "aliases": [
    "D23_1"
   ],
   "frac": [
    0.8,
    0.8,
    0.8
   ],
   "id": "N11"
  }
 ],
 "schema": "atlas-cell-graph/1.0"
}
