{
 "cell": {
  "size_mm": 5.0
 },
 "default_radius_mm": 0.5,
 "edges": [
  {
   "n1": "N0",
   "n2": "N1",
   "shift": [
    0,
    0,
    0
   ]
  },
  {
   "n1": "N0",
   "n2": "N10",
   "shift": [
    -1,
    0,
    0
   ]
  },
  {
   "n1": "N0",
   "n2": "N2",
   "shift": [
    0,
    0,
    0
   ]
  },
  {
   "n1": "N0",
   "n2": "N4",
   "shift": [
    0,
    0,
    0
   ]
  },
  {
   "n1": "N1",
   "n2": "N11",
   "shift": [
    -1,
    0,
    0
   ]
  },
  {
   "n1": "N1",
   "n2": "N3",
   "shift": [
    0,
    0,
    0
   ]
  },
  {
   "n1": "N1",
   "n2": "N5",
   "shift": [
    0,
    0,
    0
   ]
  },
  {
   "n1": "N10",
   "n2": "N3",
   "shift": [
    1,
    -1,
    0
   ]
  },
  {
   "n1": "N10",
   "n2": "N6",
   "shift": [
    0,
    0,
    0
   ]
  },
  {
   "n1": "N10",
   "n2": "N7",
   "shift": [
    0,
    0,
    0
   ]
  },
  {
   "n1": "N11",
   "n2": "N2",
   "shift": [
    1,
    0,
    -1
   ]
  },
  {
   "n1": "N11",
   "n2": "N8",
   "shift": [
    0,
    0,
    0
   ]
  },
  {
   "n1": "N11",
   "n2": "N9",
   "shift": [
    0,
    0,
    0
   ]
  },
  {
   "n1": "N2",
   "n2": "N3",
   "shift": [
    0,
    0,
    0
   ]
  },
  {
   "n1": "N2",
   "n2": "N5",
   "shift": [
    0,
    0,
    1
   ]
  },
  {
   "n1": "N3",
   "n2": "N4",
   "shift": [
    0,
    1,
    0
   ]
  },
  {
   "n1": "N4",
   "n2": "N6",
   "shift": [
    0,
    0,
    0
   ]
  },
  {
   "n1": "N4",
   "n2": "N7",
   "shift": [
    0,
    0,
    0
   ]
  },
  {
   "n1": "N5",
   "n2": "N8",
   "shift": [
    0,
    0,
    0
   ]
  },
  {
   "n1": "N5",
   "n2": "N9",
   "shift": [
    0,
    0,
    0
   ]
  },
  {
   "n1": "N6",
   "n2": "N8",
   "shift": [
    0,
    0,
    0
   ]
  },
  {
   "n1": "N6",
   "n2": "N9",
   "shift": [
    0,
    -1,
    0
   ]
  },
  {
   "n1": "N7",
   "n2": "N8",
   "shift": [
    0,
    0,
    1
   ]
  },
  {
   "n1": "N7",
   "n2": "N9",
   "shift": [
    0,
    -1,
    1
   ]
  }
 ],
 "free_params": {
  "radius_mm": {
   "description": "全局杆半径(DB 覆盖区间)",
   "max": 0.55,
   "min": 0.25,
   "value": 0.5
  },
  "slider": {
   "description": "structure_set 拓扑变形参数(部分拓扑在 slider=8 改变连通性)",
   "max": 8.0,
   "min": 0.0,
   "value": 4.0
  }
 },
 "lineage": {
  "generator": "atlas.schema.seeds.seed_graph",
  "notes": [
   "原始杆去重 12 条(同 (n1,n2,shift))"
  ],
  "parents": [],
  "source": "ARTC-Auto-Script structure_set.get_crystal_structure(topology=Kelvin, slider=4)",
  "tier": "seed"
 },
 "name": "Kelvin",
 "nodes": [
  {
   "aliases": [
    "L4",
    "R4"
   ],
   "frac": [
    0.0,
    0.23,
    0.5
   ],
   "id": "N0"
  },
  {
   "aliases": [
    "L3",
    "R3"
   ],
   "frac": [
    0.0,
    0.5,
    0.23
   ],
   "id": "N1"
  },
  {
   "aliases": [
    "L1",
    "R1"
   ],
   "frac": [
    0.0,
    0.5,
    0.77
   ],
   "id": "N2"
  },
  {
   "aliases": [
    "L2",
    "R2"
   ],
   "frac": [
    0.0,
    0.77,
    0.5
   ],
   "id": "N3"
  },
  {
   "aliases": [
    "Ba4",
    "F4"
   ],
   "frac": [
    0.23,
    0.0,
    0.5
   ],
   "id": "N4"
  },
  {
   "aliases": [
    "Bt4",
    "T4"
   ],
   "frac": [
    0.23,
    0.5,
    0.0
   ],
   "id": "N5"
  },
  {
   "aliases": [
    "Ba3",
    "F3"
   ],
   "frac": [
    0.5,
    0.0,
    0.23
   ],
   "id": "N6"
  },
  {
   "aliases": [
    "Ba1",
    "F1"
   ],
   "frac": [
    0.5,
    0.0,
    0.77
   ],
   "id": "N7"
  },
  {
   "aliases": [
    "Bt3",
    "T3"
   ],
   "frac": [
    0.5,
    0.23,
    0.0
   ],
   "id": "N8"
  },
  {
   "aliases": [
    "Bt1",
    "T1"
   ],
   "frac": [
    0.5,
    0.77,
    0.0
   ],
   "id": "N9"
  },
  {
   "aliases": [
    "Ba2",
    "F2"
   ],
   "frac": [
    0.77,
    0.0,
    0.5
   ],
   "id": "N10"
  },
  {
   "aliases": [
    "Bt2",
    "T2"
   ],
   "frac": [
    0.77,
    0.5,
    0.0
   ],
   "id": "N11"
  }
 ],
 "schema": "atlas-cell-graph/1.0"
}
