{
 "cell": {
  "size_mm": 5.0
 },
 "default_radius_mm": 0.5,
 "edges": [
  {
   "n1": "N0",
   "n2": "N4",
   "shift": [
    0,
    0,
    0
   ]
  },
  {
   "n1": "N0",
   "n2": "N6",
   "shift": [
    -1,
    0,
    0
   ]
  },
  {
   "n1": "N1",
   "n2": "N5",
   "shift": [
    0,
    0,
    0
   ]
  },
  {
   "n1": "N1",
   "n2": "N7",
   "shift": [
    -1,
    0,
    0
   ]
  },
  {
   "n1": "N2",
   "n2": "N4",
   "shift": [
    0,
    0,
    0
   ]
  },
  {
   "n1": "N2",
   "n2": "N4",
   "shift": [
    0,
    1,
    0
   ]
  },
  {
   "n1": "N2",
   "n2": "N5",
   "shift": [
    0,
    0,
    0
   ]
  },
  {
   "n1": "N2",
   "n2": "N5",
   "shift": [
    0,
    0,
    1
   ]
  },
  {
   "n1": "N2",
   "n2": "N6",
   "shift": [
    -1,
    0,
    0
   ]
  },
  {
   "n1": "N2",
   "n2": "N6",
   "shift": [
    -1,
    1,
    0
   ]
  },
  {
   "n1": "N2",
   "n2": "N7",
   "shift": [
    -1,
    0,
    0
   ]
  },
  {
   "n1": "N2",
   "n2": "N7",
   "shift": [
    -1,
    0,
    1
   ]
  },
  {
   "n1": "N3",
   "n2": "N4",
   "shift": [
    0,
    0,
    -1
   ]
  },
  {
   "n1": "N3",
   "n2": "N4",
   "shift": [
    0,
    0,
    0
   ]
  },
  {
   "n1": "N3",
   "n2": "N5",
   "shift": [
    0,
    -1,
    0
   ]
  },
  {
   "n1": "N3",
   "n2": "N5",
   "shift": [
    0,
    0,
    0
   ]
  },
  {
   "n1": "N3",
   "n2": "N8",
   "shift": [
    0,
    0,
    0
   ]
  },
  {
   "n1": "N6",
   "n2": "N8",
   "shift": [
    0,
    0,
    0
   ]
  },
  {
   "n1": "N6",
   "n2": "N8",
   "shift": [
    0,
    0,
    1
   ]
  },
  {
   "n1": "N7",
   "n2": "N8",
   "shift": [
    0,
    0,
    0
   ]
  },
  {
   "n1": "N7",
   "n2": "N8",
   "shift": [
    0,
    1,
    0
   ]
  }
 ],
 "free_params": {
  "radius_mm": {
   "description": "全局杆半径(DB 覆盖区间)",
   "max": 0.55,
   "min": 0.25,
   "value": 0.5
  },
  "slider": {
   "description": "structure_set 拓扑变形参数(部分拓扑在 slider=8 改变连通性)",
   "max": 8.0,
   "min": 0.0,
   "value": 4.0
  }
 },
 "lineage": {
  "generator": "atlas.schema.seeds.seed_graph",
  "notes": [
   "原始杆去重 19 条(同 (n1,n2,shift))"
  ],
  "parents": [],
  "source": "ARTC-Auto-Script structure_set.get_crystal_structure(topology=Auxetic, slider=4)",
  "tier": "seed"
 },
 "name": "Auxetic",
 "nodes": [
  {
   "aliases": [
    "WC5",
    "WC6",
    "WC7",
    "WC8"
   ],
   "frac": [
    0.0,
    0.0,
    0.5
   ],
   "id": "N0"
  },
  {
   "aliases": [
    "WC1",
    "WC2",
    "WC3",
    "WC4"
   ],
   "frac": [
    0.0,
    0.5,
    0.0
   ],
   "id": "N1"
  },
  {
   "aliases": [
    "LF",
    "RF"
   ],
   "frac": [
    0.0,
    0.5,
    0.5
   ],
   "id": "N2"
  },
  {
   "aliases": [
    "B_BL",
    "B_TL",
    "F_BL",
    "F_TL",
    "K_BL",
    "K_TL",
    "T_BL",
    "T_TL"
   ],
   "frac": [
    0.172,
    0.0,
    0.0
   ],
   "id": "N3"
  },
  {
   "aliases": [
    "F_WL",
    "K_WL"
   ],
   "frac": [
    0.328,
    0.0,
    0.5
   ],
   "id": "N4"
  },
  {
   "aliases": [
    "B_WL",
    "T_WL"
   ],
   "frac": [
    0.328,
    0.5,
    0.0
   ],
   "id": "N5"
  },
  {
   "aliases": [
    "F_WR",
    "K_WR"
   ],
   "frac": [
    0.672,
    0.0,
    0.5
   ],
   "id": "N6"
  },
  {
   "aliases": [
    "B_WR",
    "T_WR"
   ],
   "frac": [
    0.672,
    0.5,
    0.0
   ],
   "id": "N7"
  },
  {
   "aliases": [
    "B_BR",
    "B_TR",
    "F_BR",
    "F_TR",
    "K_BR",
    "K_TR",
    "T_BR",
    "T_TR"
   ],
   "frac": [
    0.828,
    0.0,
    0.0
   ],
   "id": "N8"
  }
 ],
 "schema": "atlas-cell-graph/1.0"
}
