{
 "cell": {
  "size_mm": 5.0
 },
 "default_radius_mm": 0.5,
 "edges": [
  {
   "n1": "N0",
   "n2": "N1",
   "shift": [
    0,
    0,
    0
   ]
  },
  {
   "n1": "N0",
   "n2": "N2",
   "shift": [
    0,
    0,
    0
   ]
  },
  {
   "n1": "N0",
   "n2": "N20",
   "shift": [
    -1,
    0,
    0
   ]
  },
  {
   "n1": "N0",
   "n2": "N8",
   "shift": [
    0,
    0,
    0
   ]
  },
  {
   "n1": "N1",
   "n2": "N21",
   "shift": [
    -1,
    0,
    0
   ]
  },
  {
   "n1": "N1",
   "n2": "N3",
   "shift": [
    0,
    0,
    0
   ]
  },
  {
   "n1": "N1",
   "n2": "N9",
   "shift": [
    0,
    0,
    0
   ]
  },
  {
   "n1": "N10",
   "n2": "N11",
   "shift": [
    0,
    0,
    0
   ]
  },
  {
   "n1": "N10",
   "n2": "N14",
   "shift": [
    0,
    0,
    0
   ]
  },
  {
   "n1": "N10",
   "n2": "N2",
   "shift": [
    0,
    0,
    0
   ]
  },
  {
   "n1": "N10",
   "n2": "N3",
   "shift": [
    0,
    0,
    -1
   ]
  },
  {
   "n1": "N11",
   "n2": "N15",
   "shift": [
    0,
    0,
    0
   ]
  },
  {
   "n1": "N11",
   "n2": "N4",
   "shift": [
    0,
    0,
    0
   ]
  },
  {
   "n1": "N11",
   "n2": "N5",
   "shift": [
    0,
    0,
    -1
   ]
  },
  {
   "n1": "N12",
   "n2": "N14",
   "shift": [
    0,
    0,
    0
   ]
  },
  {
   "n1": "N12",
   "n2": "N15",
   "shift": [
    0,
    -1,
    0
   ]
  },
  {
   "n1": "N12",
   "n2": "N16",
   "shift": [
    0,
    0,
    0
   ]
  },
  {
   "n1": "N12",
   "n2": "N8",
   "shift": [
    0,
    0,
    0
   ]
  },
  {
   "n1": "N13",
   "n2": "N14",
   "shift": [
    0,
    0,
    1
   ]
  },
  {
   "n1": "N13",
   "n2": "N15",
   "shift": [
    0,
    -1,
    1
   ]
  },
  {
   "n1": "N13",
   "n2": "N17",
   "shift": [
    0,
    0,
    0
   ]
  },
  {
   "n1": "N13",
   "n2": "N9",
   "shift": [
    0,
    0,
    0
   ]
  },
  {
   "n1": "N14",
   "n2": "N18",
   "shift": [
    0,
    0,
    0
   ]
  },
  {
   "n1": "N15",
   "n2": "N19",
   "shift": [
    0,
    0,
    0
   ]
  },
  {
   "n1": "N16",
   "n2": "N18",
   "shift": [
    0,
    0,
    0
   ]
  },
  {
   "n1": "N16",
   "n2": "N19",
   "shift": [
    0,
    -1,
    0
   ]
  },
  {
   "n1": "N16",
   "n2": "N20",
   "shift": [
    0,
    0,
    0
   ]
  },
  {
   "n1": "N17",
   "n2": "N18",
   "shift": [
    0,
    0,
    1
   ]
  },
  {
   "n1": "N17",
   "n2": "N19",
   "shift": [
    0,
    -1,
    1
   ]
  },
  {
   "n1": "N17",
   "n2": "N21",
   "shift": [
    0,
    0,
    0
   ]
  },
  {
   "n1": "N18",
   "n2": "N22",
   "shift": [
    0,
    0,
    0
   ]
  },
  {
   "n1": "N19",
   "n2": "N23",
   "shift": [
    0,
    0,
    0
   ]
  },
  {
   "n1": "N2",
   "n2": "N22",
   "shift": [
    -1,
    0,
    0
   ]
  },
  {
   "n1": "N2",
   "n2": "N4",
   "shift": [
    0,
    0,
    0
   ]
  },
  {
   "n1": "N20",
   "n2": "N21",
   "shift": [
    0,
    0,
    0
   ]
  },
  {
   "n1": "N20",
   "n2": "N6",
   "shift": [
    1,
    -1,
    0
   ]
  },
  {
   "n1": "N21",
   "n2": "N7",
   "shift": [
    1,
    -1,
    0
   ]
  },
  {
   "n1": "N22",
   "n2": "N23",
   "shift": [
    0,
    0,
    0
   ]
  },
  {
   "n1": "N22",
   "n2": "N3",
   "shift": [
    1,
    0,
    -1
   ]
  },
  {
   "n1": "N23",
   "n2": "N4",
   "shift": [
    1,
    0,
    0
   ]
  },
  {
   "n1": "N23",
   "n2": "N5",
   "shift": [
    1,
    0,
    -1
   ]
  },
  {
   "n1": "N3",
   "n2": "N5",
   "shift": [
    0,
    0,
    0
   ]
  },
  {
   "n1": "N4",
   "n2": "N6",
   "shift": [
    0,
    0,
    0
   ]
  },
  {
   "n1": "N5",
   "n2": "N7",
   "shift": [
    0,
    0,
    0
   ]
  },
  {
   "n1": "N6",
   "n2": "N7",
   "shift": [
    0,
    0,
    0
   ]
  },
  {
   "n1": "N6",
   "n2": "N8",
   "shift": [
    0,
    1,
    0
   ]
  },
  {
   "n1": "N7",
   "n2": "N9",
   "shift": [
    0,
    1,
    0
   ]
  },
  {
   "n1": "N8",
   "n2": "N9",
   "shift": [
    0,
    0,
    0
   ]
  }
 ],
 "free_params": {
  "radius_mm": {
   "description": "全局杆半径(DB 覆盖区间)",
   "max": 0.55,
   "min": 0.25,
   "value": 0.5
  },
  "slider": {
   "description": "structure_set 拓扑变形参数(部分拓扑在 slider=8 改变连通性)",
   "max": 8.0,
   "min": 0.0,
   "value": 4.0
  }
 },
 "lineage": {
  "generator": "atlas.schema.seeds.seed_graph",
  "notes": [
   "原始杆去重 24 条(同 (n1,n2,shift))"
  ],
  "parents": [],
  "source": "ARTC-Auto-Script structure_set.get_crystal_structure(topology=Truncated_Octoctahedron, slider=4)",
  "tier": "seed"
 },
 "name": "Truncated_Octoctahedron",
 "nodes": [
  {
   "aliases": [
    "V07",
    "V39"
   ],
   "frac": [
    0.0,
    0.20066,
    0.376
   ],
   "id": "N0"
  },
  {
   "aliases": [
    "V01",
    "V10"
   ],
   "frac": [
    0.0,
    0.20066,
    0.624
   ],
   "id": "N1"
  },
  {
   "aliases": [
    "V15",
    "V26"
   ],
   "frac": [
    0.0,
    0.376,
    0.20066
   ],
   "id": "N2"
  },
  {
   "aliases": [
    "V31",
    "V38"
   ],
   "frac": [
    0.0,
    0.376,
    0.79934
   ],
   "id": "N3"
  },
  {
   "aliases": [
    "V02",
    "V14"
   ],
   "frac": [
    0.0,
    0.624,
    0.20066
   ],
   "id": "N4"
  },
  {
   "aliases": [
    "V18",
    "V27"
   ],
   "frac": [
    0.0,
    0.624,
    0.79934
   ],
   "id": "N5"
  },
  {
   "aliases": [
    "V29",
    "V41"
   ],
   "frac": [
    0.0,
    0.79934,
    0.376
   ],
   "id": "N6"
  },
  {
   "aliases": [
    "V33",
    "V40"
   ],
   "frac": [
    0.0,
    0.79934,
    0.624
   ],
   "id": "N7"
  },
  {
   "aliases": [
    "V09",
    "V45"
   ],
   "frac": [
    0.20066,
    0.0,
    0.376
   ],
   "id": "N8"
  },
  {
   "aliases": [
    "V06",
    "V47"
   ],
   "frac": [
    0.20066,
    0.0,
    0.624
   ],
   "id": "N9"
  },
  {
   "aliases": [
    "V23",
    "V48"
   ],
   "frac": [
    0.20066,
    0.376,
    0.0
   ],
   "id": "N10"
  },
  {
   "aliases": [
    "V05",
    "V25"
   ],
   "frac": [
    0.20066,
    0.624,
    0.0
   ],
   "id": "N11"
  },
  {
   "aliases": [
    "V04",
    "V17"
   ],
   "frac": [
    0.376,
    0.0,
    0.20066
   ],
   "id": "N12"
  },
  {
   "aliases": [
    "V20",
    "V34"
   ],
   "frac": [
    0.376,
    0.0,
    0.79934
   ],
   "id": "N13"
  },
  {
   "aliases": [
    "V11",
    "V28"
   ],
   "frac": [
    0.376,
    0.20066,
    0.0
   ],
   "id": "N14"
  },
  {
   "aliases": [
    "V21",
    "V46"
   ],
   "frac": [
    0.376,
    0.79934,
    0.0
   ],
   "id": "N15"
  },
  {
   "aliases": [
    "V08",
    "V36"
   ],
   "frac": [
    0.624,
    0.0,
    0.20066
   ],
   "id": "N16"
  },
  {
   "aliases": [
    "V12",
    "V22"
   ],
   "frac": [
    0.624,
    0.0,
    0.79934
   ],
   "id": "N17"
  },
  {
   "aliases": [
    "V19",
    "V43"
   ],
   "frac": [
    0.624,
    0.20066,
    0.0
   ],
   "id": "N18"
  },
  {
   "aliases": [
    "V16",
    "V37"
   ],
   "frac": [
    0.624,
    0.79934,
    0.0
   ],
   "id": "N19"
  },
  {
   "aliases": [
    "V32",
    "V44"
   ],
   "frac": [
    0.79934,
    0.0,
    0.376
   ],
   "id": "N20"
  },
  {
   "aliases": [
    "V30",
    "V42"
   ],
   "frac": [
    0.79934,
    0.0,
    0.624
   ],
   "id": "N21"
  },
  {
   "aliases": [
    "V13",
    "V35"
   ],
   "frac": [
    0.79934,
    0.376,
    0.0
   ],
   "id": "N22"
  },
  {
   "aliases": [
    "V03",
    "V24"
   ],
   "frac": [
    0.79934,
    0.624,
    0.0
   ],
   "id": "N23"
  }
 ],
 "schema": "atlas-cell-graph/1.0"
}
